question,reference_answer,llm_answer,retrieved_context,answer_similarity_score,retrieval_precision,augmentation_precision,augmentation_accuracy,answer_consistency,overall_score
What makes Sam Altman a good founder?,He has a great force of will.,"Sam Altman is considered a good founder because he is successful and influential in the startup community. He is known for his determination and force of will, which allows him to achieve what he wants. Additionally, he is highly regarded for his strategic thinking and ambition. Altman's track record and expertise make him a valuable resource for advising startups.","[""If they know they can't fire the founders, they'll have to choose founders they can trust.And that's who they should have been choosing all along.Thanks to Sam Altman, John Bautista, Trevor Blackwell, Paul Buchheit, Brian Chesky, Bill Clerico, Patrick Collison, Adam Goldstein, James Lindenbaum, Jessica Livingston, and Fred Wilson for reading drafts of this."", ""If I could tell startups only ten sentences, this would be one of them.Now he's cofounder of a startup called Friendfeed.It's only a year old, but already everyone in the Valley is watching them.Someone responsible for three of the biggest ideas at Google is going to come up with more.5.Sam AltmanI was told I shouldn't mention founders of YC-funded companies in this list.But Sam Altman can't be stopped by such flimsy rules.If he wants to be on this list, he's going to be."", ""This quality may be redundant though; it may be implied by imagination.Sam Altman of Loopt is one of the most successful alumni, so we asked him what question we could put on the Y Combinator application that would help us discover more people like him.He said to ask about a time when they'd hacked something to their advantage—hacked in the sense of beating the system, not breaking into computers.It has become one of the questions we pay most attention to when judging applications.5.FriendshipEmpirically it seems to be hard to start a startup with just one founder."", 'Honestly, Sam is, along with Steve Jobs, the founder I refer to most when I\'m advising startups.On questions of design, I ask ""What would Steve do?""but on questions of strategy or ambition I ask ""What would Sama do?""What I learned from meeting Sama is that the doctrine of the elect applies to startups.It applies way less than most people think: startup investing does not consist of trying to pick winners the way you might in a horse race.But there are a few people with such force of will that they\'re going to get whatever they want.', ""Most of the big successes have two or three.And the relationship between the founders has to be strong.They must genuinely like one another, and work well together.Startups do to the relationship between the founders what a dog does to a sock: if it can be pulled apart, it will be.Emmett Shear and Justin Kan of Justin.tv are a good example of close friends who work well together.They've known each other since second grade.They can practically read one another's minds.I'm sure they argue, like all founders, but I have never once sensed any unresolved tension between them."", ""Why It's Safe for Founders to Be Nice\n\nAugust 2015\n\nI recently got an email from a founder that helped me understand something important: why it's safe for startup founders to be nice people.I grew up with a cartoon idea of a very successful businessman (in the cartoon it was always a man): a rapacious, cigar-smoking, table-thumping guy in his fifties who wins by exercising power, and isn't too fussy about how.As I've written before, one of the things that has surprised me most about startups is how few of the most successful founders are like that."", 'Maybe successful people in other industries are; I don\'t know; but not startup founders.[1]I knew this empirically, but I never saw the math of why till I got this founder\'s email.In it he said he worried that he was fundamentally soft-hearted and tended to give away too much for free.He thought perhaps he needed ""a little dose of sociopath-ness.""I told him not to worry about it, because so long as he built something good enough to spread by word of mouth, he\'d have a superlinear growth curve.', ""What We Look for in Founders\n\nOctober 2010\n\nWant to start a startup?Get funded by Y Combinator.(I wrote this for Forbes, who asked me to write something about the qualities we look for in founders.In print they had to cut the last item because they didn't have room.)1.DeterminationThis has turned out to be the most important quality in startup founders.We thought when we started Y Combinator that the most important quality would be intelligence.That's the myth in the Valley.And certainly you don't want founders to be stupid."", ""Five Founders\n\nApril 2009\n\nInc recently asked me who I thought were the 5 most interesting startup founders of the last 30 years.How do you decide who's the most interesting?The best test seemed to be influence: who are the 5 who've influenced me most?Who do I use as examples when I'm talking to companies we fund?Who do I find myself quoting?1.Steve JobsI'd guess Steve is the most influential founder not just for me but for most people you could ask.A lot of startup culture is Apple culture.He was the original young founder."", ""The current record holder for flexibility may be Daniel Gross of Greplin.He applied to YC with some bad ecommerce idea.We told him we'd fund him if he did something else.He thought for a second, and said ok.He then went through two more ideas before settling on Greplin.He'd only been working on it for a couple days when he presented to investors at Demo Day, but he got a lot of interest.He always seems to land on his feet.3.ImaginationIntelligence does matter a lot of course.It seems like the type that matters most is imagination."", ""Obviously one case where it would help to be rapacious is when growth depends on that.What makes startups different is that usually it doesn't.Startups usually win by making something so great that people recommend it to their friends.And being rapacious not only doesn't help you do that, but probably hurts.[3]The reason startup founders can safely be nice is that making great things is compounded, and rapacity isn't.So if you're a founder, here's a deal you can make with yourself that will both make you happy and make your company successful."", 'Thanks to Sam Altman, Harj Taggar, Jessica Livingston, and Geoff Ralston for reading drafts of this, and to Randall Bennett for being such a nice guy.', ""I feel like we're at a tipping point here.A lot of VCs still act as if founders retaining board control after a series A is unheard-of.A lot of them try to make you feel bad if you even ask — as if you're a noob or a control freak for wanting such a thing.But the founders I heard from aren't noobs or control freaks.Or if they are, they are, like Mark Zuckerberg, the kind of noobs and control freaks VCs should be trying to fund more of.Founders retaining control after a series A is clearly heard-of."", ""As soon as we heard they'd been supporting themselves by selling Obama and McCain branded breakfast cereal, they were in.And it turned out the idea was on the right side of crazy after all.4.NaughtinessThough the most successful founders are usually good people, they tend to have a piratical gleam in their eye.They're not Goody Two-Shoes type good.Morally, they care about getting the big questions right, but not about observing proprieties.That's why I'd use the word naughty rather than evil.They delight in breaking rules, but not rules that matter."", ""Learning from Founders\n\nJanuary 2007\n\n(Foreword to Jessica Livingston's Founders at Work.)Apparently sprinters reach their highest speed right out of the blocks, and spend the rest of the race slowing down.The winners slow down the least.It's that way with most startups too.The earliest phase is usually the most productive.That's when they have the really big ideas.Imagine what Apple was like when 100% of its employees were either Steve Jobs or Steve Wozniak.The striking thing about this phase is that it's completely different from most people's idea of what business is like."", ""The switch to the new norm may be surprisingly fast, because the startups that can retain control tend to be the best ones.They're the ones that set the trends, both for other startups and for VCs.A lot of the reason VCs are harsh when negotiating with startups is that they're embarrassed to go back to their partners looking like they got beaten.When they sign a termsheet, they want to be able to brag about the good terms they got.A lot of them don't care that much personally about whether founders keep board control.They just don't want to seem like they had to make concessions.""]",4.0,0.1875,0.3333333333333333,0.0625,1.0,0.4766666666666667
"When was the essay ""Five Founders"" written?",April 2009,"The essay ""Five Founders"" was written in April 2009.","[""Five Founders\n\nApril 2009\n\nInc recently asked me who I thought were the 5 most interesting startup founders of the last 30 years.How do you decide who's the most interesting?The best test seemed to be influence: who are the 5 who've influenced me most?Who do I use as examples when I'm talking to companies we fund?Who do I find myself quoting?1.Steve JobsI'd guess Steve is the most influential founder not just for me but for most people you could ask.A lot of startup culture is Apple culture.He was the original young founder."", ""Learning from Founders\n\nJanuary 2007\n\n(Foreword to Jessica Livingston's Founders at Work.)Apparently sprinters reach their highest speed right out of the blocks, and spend the rest of the race slowing down.The winners slow down the least.It's that way with most startups too.The earliest phase is usually the most productive.That's when they have the really big ideas.Imagine what Apple was like when 100% of its employees were either Steve Jobs or Steve Wozniak.The striking thing about this phase is that it's completely different from most people's idea of what business is like."", ""TJ RodgersTJ Rodgers isn't as famous as Steve Jobs, but he may be the best writer among Silicon Valley CEOs.I've probably learned more from him about the startup way of thinking than from anyone else.Not so much from specific things he's written as by reconstructing the mind that produced them: brutally candid; aggressively garbage-collecting outdated ideas; and yet driven by pragmatism rather than ideology.The first essay of his that I read was so electrifying that I remember exactly where I was at the time.It was High Technology Innovation: Free Markets or Government Subsidies?"", ""What We Look for in Founders\n\nOctober 2010\n\nWant to start a startup?Get funded by Y Combinator.(I wrote this for Forbes, who asked me to write something about the qualities we look for in founders.In print they had to cut the last item because they didn't have room.)1.DeterminationThis has turned out to be the most important quality in startup founders.We thought when we started Y Combinator that the most important quality would be intelligence.That's the myth in the Valley.And certainly you don't want founders to be stupid."", 'Related: The United States of Entrepreneurs About Half of VC-Backed Company Founders are Immigrants.', ""As soon as we heard they'd been supporting themselves by selling Obama and McCain branded breakfast cereal, they were in.And it turned out the idea was on the right side of crazy after all.4.NaughtinessThough the most successful founders are usually good people, they tend to have a piratical gleam in their eye.They're not Goody Two-Shoes type good.Morally, they care about getting the big questions right, but not about observing proprieties.That's why I'd use the word naughty rather than evil.They delight in breaking rules, but not rules that matter."", ""If they know they can't fire the founders, they'll have to choose founders they can trust.And that's who they should have been choosing all along.Thanks to Sam Altman, John Bautista, Trevor Blackwell, Paul Buchheit, Brian Chesky, Bill Clerico, Patrick Collison, Adam Goldstein, James Lindenbaum, Jessica Livingston, and Fred Wilson for reading drafts of this."", ""Why It's Safe for Founders to Be Nice\n\nAugust 2015\n\nI recently got an email from a founder that helped me understand something important: why it's safe for startup founders to be nice people.I grew up with a cartoon idea of a very successful businessman (in the cartoon it was always a man): a rapacious, cigar-smoking, table-thumping guy in his fifties who wins by exercising power, and isn't too fussy about how.As I've written before, one of the things that has surprised me most about startups is how few of the most successful founders are like that."", ""The Founder Visa\n\nApril 2009\n\nI usually avoid politics, but since we now seem to have an administration that's open to suggestions, I'm going to risk making one.The single biggest thing the government could do to increase the number of startups in this country is a policy that would cost nothing: establish a new class of visa for startup founders.The biggest constraint on the number of new startups that get created in the US is not tax policy or employment law or even Sarbanes-Oxley.It's that we won't let the people who want to start them into the country."", ""If I could tell startups only ten sentences, this would be one of them.Now he's cofounder of a startup called Friendfeed.It's only a year old, but already everyone in the Valley is watching them.Someone responsible for three of the biggest ideas at Google is going to come up with more.5.Sam AltmanI was told I shouldn't mention founders of YC-funded companies in this list.But Sam Altman can't be stopped by such flimsy rules.If he wants to be on this list, he's going to be."", 'Thanks to Jessica Livingston and Chris Steiner for reading drafts of this.', ""We'll establish our own accreditation procedure.We know who one another are.10,000 people is a drop in the bucket by immigration standards, but would represent a huge increase in the pool of startup founders.I think this would have such a visible effect on the economy that it would make the legislator who introduced the bill famous.The only way to know for sure would be to try it, and that would cost practically nothing.Thanks to Trevor Blackwell, Paul Buchheit, Jeff Clavier, David Hornik, Jessica Livingston, Greg Mcadoo, Aydin Senkut, and Fred Wilson for reading drafts of this."", ""This quality may be redundant though; it may be implied by imagination.Sam Altman of Loopt is one of the most successful alumni, so we asked him what question we could put on the Y Combinator application that would help us discover more people like him.He said to ask about a time when they'd hacked something to their advantage—hacked in the sense of beating the system, not breaking into computers.It has become one of the questions we pay most attention to when judging applications.5.FriendshipEmpirically it seems to be hard to start a startup with just one founder."", ""Most of the big successes have two or three.And the relationship between the founders has to be strong.They must genuinely like one another, and work well together.Startups do to the relationship between the founders what a dog does to a sock: if it can be pulled apart, it will be.Emmett Shear and Justin Kan of Justin.tv are a good example of close friends who work well together.They've known each other since second grade.They can practically read one another's minds.I'm sure they argue, like all founders, but I have never once sensed any unresolved tension between them."", 'Honestly, Sam is, along with Steve Jobs, the founder I refer to most when I\'m advising startups.On questions of design, I ask ""What would Steve do?""but on questions of strategy or ambition I ask ""What would Sama do?""What I learned from meeting Sama is that the doctrine of the elect applies to startups.It applies way less than most people think: startup investing does not consist of trying to pick winners the way you might in a horse race.But there are a few people with such force of will that they\'re going to get whatever they want.', ""The really dramatic growth happens when a startup only has three or four people, so only three or four people see that, whereas tens of thousands see business as it's practiced by Boeing or Philip Morris.This book can help fix that problem, by showing everyone what, till now, only a handful people got to see: what happens in the first year of a startup.This is what real productivity looks like.This is the Formula 1 racecar.It looks weird, but it goes fast.Of course, big companies won't be able to do everything these startups do.""]",5.0,0.0625,1.0,0.0625,1.0,0.625
When does the most dramatic growth happen for a startup?,When the startup only has three or four people.,The most dramatic growth for a startup happens when it only has three or four people.,"[""The really dramatic growth happens when a startup only has three or four people, so only three or four people see that, whereas tens of thousands see business as it's practiced by Boeing or Philip Morris.This book can help fix that problem, by showing everyone what, till now, only a handful people got to see: what happens in the first year of a startup.This is what real productivity looks like.This is the Formula 1 racecar.It looks weird, but it goes fast.Of course, big companies won't be able to do everything these startups do."", ""Learning from Founders\n\nJanuary 2007\n\n(Foreword to Jessica Livingston's Founders at Work.)Apparently sprinters reach their highest speed right out of the blocks, and spend the rest of the race slowing down.The winners slow down the least.It's that way with most startups too.The earliest phase is usually the most productive.That's when they have the really big ideas.Imagine what Apple was like when 100% of its employees were either Steve Jobs or Steve Wozniak.The striking thing about this phase is that it's completely different from most people's idea of what business is like."", '[2] In fact since 2 ≈ 1.05 ^ 15, the un-rapacious founder is always 15 weeks behind the rapacious one.[3] The other reason it might help to be good at squeezing money out of customers is that startups usually lose money at first, and making more per customer makes it easier to get to profitability before your initial funding runs out.But while it is very common for startups to die from running through their initial funding and then being unable to raise more, the underlying cause is usually slow growth or excessive spending rather than insufficient effort to extract money from existing customers.', ""Tell yourself you can be as nice as you want, so long as you work hard on your growth rate to compensate.Most successful startups make that tradeoff unconsciously.Maybe if you do it consciously you'll do it even better.Notes[1] Many think successful startup founders are driven by money.In fact the secret weapon of the most successful founders is that they aren't.If they were, they'd have taken one of the acquisition offers that every fast-growing startup gets on the way up.What drives the most successful founders is the same thing that drives most people who make things: the company is their project."", 'If you looked in people\'s heads (or stock photo collections) for images representing ""business,"" you\'d get images of people dressed up in suits, groups sitting around conference tables looking serious, Powerpoint presentations, people producing thick reports for one another to read.Early stage startups are the exact opposite of this.And yet they\'re probably the most productive part of the whole economy.Why the disconnect?I think there\'s a general principle at work here: the less energy people expend on performance, the more they expend on appearances to compensate.More often than not the energy they expend on seeming impressive makes their actual performance worse.', ""[2]If you're going to optimize a number, the one to choose is your growth rate.Suppose as before that you only extract half as much from users as you could, but that you're able to grow 6% a week instead of 5% Now how are you doing compared to the rapacious founder after two years?You're already ahead—$214k a month versus $160k—and pulling away fast.In another year you'll be making $4.4 million a month to the rapacious founder's $2 million."", ""The switch to the new norm may be surprisingly fast, because the startups that can retain control tend to be the best ones.They're the ones that set the trends, both for other startups and for VCs.A lot of the reason VCs are harsh when negotiating with startups is that they're embarrassed to go back to their partners looking like they got beaten.When they sign a termsheet, they want to be able to brag about the good terms they got.A lot of them don't care that much personally about whether founders keep board control.They just don't want to seem like they had to make concessions."", ""Obviously one case where it would help to be rapacious is when growth depends on that.What makes startups different is that usually it doesn't.Startups usually win by making something so great that people recommend it to their friends.And being rapacious not only doesn't help you do that, but probably hurts.[3]The reason startup founders can safely be nice is that making great things is compounded, and rapacity isn't.So if you're a founder, here's a deal you can make with yourself that will both make you happy and make your company successful."", ""I bet most executives at big companies do their best thinking when they wake up on Sunday morning and go downstairs in their bathrobe to make a cup of coffee.That's when you have ideas.Just imagine what a company would be like if people could think that well at work.People do in startups, at least some of the time.(Half the time you're in a panic because your servers are on fire, but the other half you're thinking as deeply as most people only get to sitting alone on a Sunday morning.)Ditto for most of the other differences between startups and what passes for productivity in big companies."", ""This quality may be redundant though; it may be implied by imagination.Sam Altman of Loopt is one of the most successful alumni, so we asked him what question we could put on the Y Combinator application that would help us discover more people like him.He said to ask about a time when they'd hacked something to their advantage—hacked in the sense of beating the system, not breaking into computers.It has become one of the questions we pay most attention to when judging applications.5.FriendshipEmpirically it seems to be hard to start a startup with just one founder."", ""But as long as you're over a certain threshold of intelligence, what matters most is determination.You're going to hit a lot of obstacles.You can't be the sort of person who gets demoralized easily.Bill Clerico and Rich Aberman of WePay are a good example.They're doing a finance startup, which means endless negotiations with big, bureaucratic companies.When you're starting a startup that depends on deals with big companies to exist, it often feels like they're trying to ignore you out of existence."", ""Most of the big successes have two or three.And the relationship between the founders has to be strong.They must genuinely like one another, and work well together.Startups do to the relationship between the founders what a dog does to a sock: if it can be pulled apart, it will be.Emmett Shear and Justin Kan of Justin.tv are a good example of close friends who work well together.They've known each other since second grade.They can practically read one another's minds.I'm sure they argue, like all founders, but I have never once sensed any unresolved tension between them."", 'But when Bill Clerico starts calling you, you may as well do what he asks, because he is not going away.2.FlexibilityYou do not however want the sort of determination implied by phrases like ""don\'t give up on your dreams.""The world of startups is so unpredictable that you need to be able to modify your dreams on the fly.The best metaphor I\'ve found for the combination of determination and flexibility you need is a running back.He\'s determined to get downfield, but at any given moment he may need to go sideways or even backwards to get there.', ""In big companies there's always going to be more politics, and less scope for individual decisions.But seeing what startups are really like will at least show other organizations what to aim for.The time may soon be coming when instead of startups trying to seem more corporate, corporations will try to seem more like startups.That would be a good thing.Japanese Translation."", ""What We Look for in Founders\n\nOctober 2010\n\nWant to start a startup?Get funded by Y Combinator.(I wrote this for Forbes, who asked me to write something about the qualities we look for in founders.In print they had to cut the last item because they didn't have room.)1.DeterminationThis has turned out to be the most important quality in startup founders.We thought when we started Y Combinator that the most important quality would be intelligence.That's the myth in the Valley.And certainly you don't want founders to be stupid."", ""Not even investors, who are supposed to be able to recognize real productivity when they see it.Even we were affected by the conventional wisdom.We thought of ourselves as impostors, succeeding despite being totally unprofessional.It was as if we'd created a Formula 1 car but felt sheepish because it didn't look like a car was supposed to look.In the car world, there are at least some people who know that a high performance car looks like a Formula 1 racecar, not a sedan with giant rims and a fake spoiler bolted to the trunk.Why not in business?Probably because startups are so small.""]",5.0,0.125,1.0,0.125,1.0,0.65
What is the problem with business culture versus start up culture with respect to productivity?,"In business culture, energy is expended on outward appearance to the detriment of productivity, while in startup culture there is no value of appearance it's all about productivity.","The problem with business culture versus start-up culture with respect to productivity is that in business culture, there is often a focus on appearances and seeming impressive, rather than actual performance. This leads to a lot of energy being expended on looking professional and following conventional ideas of professionalism, rather than on achieving real productivity. In contrast, start-up culture values actual performance and focuses on getting things done, even if it means working in unconventional ways or not conforming to traditional notions of professionalism. This difference in mindset and approach to work can result in start-ups being more productive than big companies.","['If you looked in people\'s heads (or stock photo collections) for images representing ""business,"" you\'d get images of people dressed up in suits, groups sitting around conference tables looking serious, Powerpoint presentations, people producing thick reports for one another to read.Early stage startups are the exact opposite of this.And yet they\'re probably the most productive part of the whole economy.Why the disconnect?I think there\'s a general principle at work here: the less energy people expend on performance, the more they expend on appearances to compensate.More often than not the energy they expend on seeming impressive makes their actual performance worse.', ""The really dramatic growth happens when a startup only has three or four people, so only three or four people see that, whereas tens of thousands see business as it's practiced by Boeing or Philip Morris.This book can help fix that problem, by showing everyone what, till now, only a handful people got to see: what happens in the first year of a startup.This is what real productivity looks like.This is the Formula 1 racecar.It looks weird, but it goes fast.Of course, big companies won't be able to do everything these startups do."", ""Not even investors, who are supposed to be able to recognize real productivity when they see it.Even we were affected by the conventional wisdom.We thought of ourselves as impostors, succeeding despite being totally unprofessional.It was as if we'd created a Formula 1 car but felt sheepish because it didn't look like a car was supposed to look.In the car world, there are at least some people who know that a high performance car looks like a Formula 1 racecar, not a sedan with giant rims and a fake spoiler bolted to the trunk.Why not in business?Probably because startups are so small."", ""I bet most executives at big companies do their best thinking when they wake up on Sunday morning and go downstairs in their bathrobe to make a cup of coffee.That's when you have ideas.Just imagine what a company would be like if people could think that well at work.People do in startups, at least some of the time.(Half the time you're in a panic because your servers are on fire, but the other half you're thinking as deeply as most people only get to sitting alone on a Sunday morning.)Ditto for most of the other differences between startups and what passes for productivity in big companies."", 'And yet conventional ideas of professionalism have such an iron grip on our minds that even startup founders are affected by them.In our startup, when outsiders came to visit we tried hard to seem ""professional.""We\'d clean up our offices, wear better clothes, try to arrange that a lot of people were there during conventional office hours.In fact, programming didn\'t get done by well-dressed people at clean desks during office hours.It got done by badly dressed people (I was notorious for programmming wearing just a towel) in offices strewn with junk at 2 in the morning.But no visitor would understand that.', ""In big companies there's always going to be more politics, and less scope for individual decisions.But seeing what startups are really like will at least show other organizations what to aim for.The time may soon be coming when instead of startups trying to seem more corporate, corporations will try to seem more like startups.That would be a good thing.Japanese Translation."", ""Learning from Founders\n\nJanuary 2007\n\n(Foreword to Jessica Livingston's Founders at Work.)Apparently sprinters reach their highest speed right out of the blocks, and spend the rest of the race slowing down.The winners slow down the least.It's that way with most startups too.The earliest phase is usually the most productive.That's when they have the really big ideas.Imagine what Apple was like when 100% of its employees were either Steve Jobs or Steve Wozniak.The striking thing about this phase is that it's completely different from most people's idea of what business is like."", '[2] In fact since 2 ≈ 1.05 ^ 15, the un-rapacious founder is always 15 weeks behind the rapacious one.[3] The other reason it might help to be good at squeezing money out of customers is that startups usually lose money at first, and making more per customer makes it easier to get to profitability before your initial funding runs out.But while it is very common for startups to die from running through their initial funding and then being unable to raise more, the underlying cause is usually slow growth or excessive spending rather than insufficient effort to extract money from existing customers.', ""In fact they'd cause there to be more jobs for Americans, because the companies they started would hire more employees as they grew.The tricky part might seem to be how one defined a startup.But that could be solved quite easily: let the market decide.Startup investors work hard to find the best startups.The government could not do better than to piggyback on their expertise, and use investment by recognized startup investors as the test of whether a company was a real startup.How would the government decide who's a startup investor?The same way they decide what counts as a university for student visas."", ""Tell yourself you can be as nice as you want, so long as you work hard on your growth rate to compensate.Most successful startups make that tradeoff unconsciously.Maybe if you do it consciously you'll do it even better.Notes[1] Many think successful startup founders are driven by money.In fact the secret weapon of the most successful founders is that they aren't.If they were, they'd have taken one of the acquisition offers that every fast-growing startup gets on the way up.What drives the most successful founders is the same thing that drives most people who make things: the company is their project."", ""The switch to the new norm may be surprisingly fast, because the startups that can retain control tend to be the best ones.They're the ones that set the trends, both for other startups and for VCs.A lot of the reason VCs are harsh when negotiating with startups is that they're embarrassed to go back to their partners looking like they got beaten.When they sign a termsheet, they want to be able to brag about the good terms they got.A lot of them don't care that much personally about whether founders keep board control.They just don't want to seem like they had to make concessions."", ""Obviously one case where it would help to be rapacious is when growth depends on that.What makes startups different is that usually it doesn't.Startups usually win by making something so great that people recommend it to their friends.And being rapacious not only doesn't help you do that, but probably hurts.[3]The reason startup founders can safely be nice is that making great things is compounded, and rapacity isn't.So if you're a founder, here's a deal you can make with yourself that will both make you happy and make your company successful."", ""But as long as you're over a certain threshold of intelligence, what matters most is determination.You're going to hit a lot of obstacles.You can't be the sort of person who gets demoralized easily.Bill Clerico and Rich Aberman of WePay are a good example.They're doing a finance startup, which means endless negotiations with big, bureaucratic companies.When you're starting a startup that depends on deals with big companies to exist, it often feels like they're trying to ignore you out of existence."", ""This quality may be redundant though; it may be implied by imagination.Sam Altman of Loopt is one of the most successful alumni, so we asked him what question we could put on the Y Combinator application that would help us discover more people like him.He said to ask about a time when they'd hacked something to their advantage—hacked in the sense of beating the system, not breaking into computers.It has become one of the questions we pay most attention to when judging applications.5.FriendshipEmpirically it seems to be hard to start a startup with just one founder."", ""Letting just 10,000 startup founders into the country each year could have a visible effect on the economy.If we assume 4 people per startup, which is probably an overestimate, that's 2500 new companies.Each year.They wouldn't all grow as big as Google, but out of 2500 some would come close.By definition these 10,000 founders wouldn't be taking jobs from Americans: it could be part of the terms of the visa that they couldn't work for existing companies, only new ones they'd founded."", 'But when Bill Clerico starts calling you, you may as well do what he asks, because he is not going away.2.FlexibilityYou do not however want the sort of determination implied by phrases like ""don\'t give up on your dreams.""The world of startups is so unpredictable that you need to be able to modify your dreams on the fly.The best metaphor I\'ve found for the combination of determination and flexibility you need is a running back.He\'s determined to get downfield, but at any given moment he may need to go sideways or even backwards to get there.']",5.0,0.375,0.3333333333333333,0.125,1.0,0.5666666666666667
What's the single biggest thing the government could do to increase the number of startups in this country?,Establish a new class of visa for startup founders.,Establish a new class of visa for startup founders.,"[""The Founder Visa\n\nApril 2009\n\nI usually avoid politics, but since we now seem to have an administration that's open to suggestions, I'm going to risk making one.The single biggest thing the government could do to increase the number of startups in this country is a policy that would cost nothing: establish a new class of visa for startup founders.The biggest constraint on the number of new startups that get created in the US is not tax policy or employment law or even Sarbanes-Oxley.It's that we won't let the people who want to start them into the country."", ""In fact they'd cause there to be more jobs for Americans, because the companies they started would hire more employees as they grew.The tricky part might seem to be how one defined a startup.But that could be solved quite easily: let the market decide.Startup investors work hard to find the best startups.The government could not do better than to piggyback on their expertise, and use investment by recognized startup investors as the test of whether a company was a real startup.How would the government decide who's a startup investor?The same way they decide what counts as a university for student visas."", ""Letting just 10,000 startup founders into the country each year could have a visible effect on the economy.If we assume 4 people per startup, which is probably an overestimate, that's 2500 new companies.Each year.They wouldn't all grow as big as Google, but out of 2500 some would come close.By definition these 10,000 founders wouldn't be taking jobs from Americans: it could be part of the terms of the visa that they couldn't work for existing companies, only new ones they'd founded."", ""We'll establish our own accreditation procedure.We know who one another are.10,000 people is a drop in the bucket by immigration standards, but would represent a huge increase in the pool of startup founders.I think this would have such a visible effect on the economy that it would make the legislator who introduced the bill famous.The only way to know for sure would be to try it, and that would cost practically nothing.Thanks to Trevor Blackwell, Paul Buchheit, Jeff Clavier, David Hornik, Jessica Livingston, Greg Mcadoo, Aydin Senkut, and Fred Wilson for reading drafts of this."", ""This quality may be redundant though; it may be implied by imagination.Sam Altman of Loopt is one of the most successful alumni, so we asked him what question we could put on the Y Combinator application that would help us discover more people like him.He said to ask about a time when they'd hacked something to their advantage—hacked in the sense of beating the system, not breaking into computers.It has become one of the questions we pay most attention to when judging applications.5.FriendshipEmpirically it seems to be hard to start a startup with just one founder."", ""The really dramatic growth happens when a startup only has three or four people, so only three or four people see that, whereas tens of thousands see business as it's practiced by Boeing or Philip Morris.This book can help fix that problem, by showing everyone what, till now, only a handful people got to see: what happens in the first year of a startup.This is what real productivity looks like.This is the Formula 1 racecar.It looks weird, but it goes fast.Of course, big companies won't be able to do everything these startups do."", 'Related: The United States of Entrepreneurs About Half of VC-Backed Company Founders are Immigrants.', ""What We Look for in Founders\n\nOctober 2010\n\nWant to start a startup?Get funded by Y Combinator.(I wrote this for Forbes, who asked me to write something about the qualities we look for in founders.In print they had to cut the last item because they didn't have room.)1.DeterminationThis has turned out to be the most important quality in startup founders.We thought when we started Y Combinator that the most important quality would be intelligence.That's the myth in the Valley.And certainly you don't want founders to be stupid."", ""In big companies there's always going to be more politics, and less scope for individual decisions.But seeing what startups are really like will at least show other organizations what to aim for.The time may soon be coming when instead of startups trying to seem more corporate, corporations will try to seem more like startups.That would be a good thing.Japanese Translation."", ""Tell yourself you can be as nice as you want, so long as you work hard on your growth rate to compensate.Most successful startups make that tradeoff unconsciously.Maybe if you do it consciously you'll do it even better.Notes[1] Many think successful startup founders are driven by money.In fact the secret weapon of the most successful founders is that they aren't.If they were, they'd have taken one of the acquisition offers that every fast-growing startup gets on the way up.What drives the most successful founders is the same thing that drives most people who make things: the company is their project."", ""Obviously one case where it would help to be rapacious is when growth depends on that.What makes startups different is that usually it doesn't.Startups usually win by making something so great that people recommend it to their friends.And being rapacious not only doesn't help you do that, but probably hurts.[3]The reason startup founders can safely be nice is that making great things is compounded, and rapacity isn't.So if you're a founder, here's a deal you can make with yourself that will both make you happy and make your company successful."", ""If I could tell startups only ten sentences, this would be one of them.Now he's cofounder of a startup called Friendfeed.It's only a year old, but already everyone in the Valley is watching them.Someone responsible for three of the biggest ideas at Google is going to come up with more.5.Sam AltmanI was told I shouldn't mention founders of YC-funded companies in this list.But Sam Altman can't be stopped by such flimsy rules.If he wants to be on this list, he's going to be."", 'Honestly, Sam is, along with Steve Jobs, the founder I refer to most when I\'m advising startups.On questions of design, I ask ""What would Steve do?""but on questions of strategy or ambition I ask ""What would Sama do?""What I learned from meeting Sama is that the doctrine of the elect applies to startups.It applies way less than most people think: startup investing does not consist of trying to pick winners the way you might in a horse race.But there are a few people with such force of will that they\'re going to get whatever they want.', ""Founder Control\n\nDecember 2010\n\nWant to start a startup?Get funded by Y Combinator.Someone we funded is talking to VCs now, and asked me how common it was for a startup's founders to retain control of the board after a series A round.He said VCs told him this almost never happened.Ten years ago that was true.In the past, founders rarely kept control of the board through a series A.The traditional series A board consisted of two founders, two VCs, and one independent member.More recently the recipe is often one founder, one VC, and one independent."", 'If you looked in people\'s heads (or stock photo collections) for images representing ""business,"" you\'d get images of people dressed up in suits, groups sitting around conference tables looking serious, Powerpoint presentations, people producing thick reports for one another to read.Early stage startups are the exact opposite of this.And yet they\'re probably the most productive part of the whole economy.Why the disconnect?I think there\'s a general principle at work here: the less energy people expend on performance, the more they expend on appearances to compensate.More often than not the energy they expend on seeming impressive makes their actual performance worse.', ""Learning from Founders\n\nJanuary 2007\n\n(Foreword to Jessica Livingston's Founders at Work.)Apparently sprinters reach their highest speed right out of the blocks, and spend the rest of the race slowing down.The winners slow down the least.It's that way with most startups too.The earliest phase is usually the most productive.That's when they have the really big ideas.Imagine what Apple was like when 100% of its employees were either Steve Jobs or Steve Wozniak.The striking thing about this phase is that it's completely different from most people's idea of what business is like.""]",5.0,0.1875,0.3333333333333333,0.0625,1.0,0.5166666666666666
How could one create a rigorous government definition of what a startup is to categorize whether a business is a startup?,One could define a startup as a company that has received investment by recognized startup investors. An accreditation procedure would be determined to establish recognized startup investors.,"The government could establish a new class of visa for startup founders and use investment by recognized startup investors as the test of whether a company is a real startup. This would allow the market to decide what qualifies as a startup, as startup investors work hard to find the best startups. By piggybacking on their expertise, the government can use investment by recognized startup investors as a measure of whether a company meets the criteria to be classified as a startup. This approach would provide a rigorous government definition of what a startup is.","[""In fact they'd cause there to be more jobs for Americans, because the companies they started would hire more employees as they grew.The tricky part might seem to be how one defined a startup.But that could be solved quite easily: let the market decide.Startup investors work hard to find the best startups.The government could not do better than to piggyback on their expertise, and use investment by recognized startup investors as the test of whether a company was a real startup.How would the government decide who's a startup investor?The same way they decide what counts as a university for student visas."", ""The Founder Visa\n\nApril 2009\n\nI usually avoid politics, but since we now seem to have an administration that's open to suggestions, I'm going to risk making one.The single biggest thing the government could do to increase the number of startups in this country is a policy that would cost nothing: establish a new class of visa for startup founders.The biggest constraint on the number of new startups that get created in the US is not tax policy or employment law or even Sarbanes-Oxley.It's that we won't let the people who want to start them into the country."", ""The really dramatic growth happens when a startup only has three or four people, so only three or four people see that, whereas tens of thousands see business as it's practiced by Boeing or Philip Morris.This book can help fix that problem, by showing everyone what, till now, only a handful people got to see: what happens in the first year of a startup.This is what real productivity looks like.This is the Formula 1 racecar.It looks weird, but it goes fast.Of course, big companies won't be able to do everything these startups do."", ""In big companies there's always going to be more politics, and less scope for individual decisions.But seeing what startups are really like will at least show other organizations what to aim for.The time may soon be coming when instead of startups trying to seem more corporate, corporations will try to seem more like startups.That would be a good thing.Japanese Translation."", ""Letting just 10,000 startup founders into the country each year could have a visible effect on the economy.If we assume 4 people per startup, which is probably an overestimate, that's 2500 new companies.Each year.They wouldn't all grow as big as Google, but out of 2500 some would come close.By definition these 10,000 founders wouldn't be taking jobs from Americans: it could be part of the terms of the visa that they couldn't work for existing companies, only new ones they'd founded."", ""This quality may be redundant though; it may be implied by imagination.Sam Altman of Loopt is one of the most successful alumni, so we asked him what question we could put on the Y Combinator application that would help us discover more people like him.He said to ask about a time when they'd hacked something to their advantage—hacked in the sense of beating the system, not breaking into computers.It has become one of the questions we pay most attention to when judging applications.5.FriendshipEmpirically it seems to be hard to start a startup with just one founder."", 'If you looked in people\'s heads (or stock photo collections) for images representing ""business,"" you\'d get images of people dressed up in suits, groups sitting around conference tables looking serious, Powerpoint presentations, people producing thick reports for one another to read.Early stage startups are the exact opposite of this.And yet they\'re probably the most productive part of the whole economy.Why the disconnect?I think there\'s a general principle at work here: the less energy people expend on performance, the more they expend on appearances to compensate.More often than not the energy they expend on seeming impressive makes their actual performance worse.', ""We'll establish our own accreditation procedure.We know who one another are.10,000 people is a drop in the bucket by immigration standards, but would represent a huge increase in the pool of startup founders.I think this would have such a visible effect on the economy that it would make the legislator who introduced the bill famous.The only way to know for sure would be to try it, and that would cost practically nothing.Thanks to Trevor Blackwell, Paul Buchheit, Jeff Clavier, David Hornik, Jessica Livingston, Greg Mcadoo, Aydin Senkut, and Fred Wilson for reading drafts of this."", ""Not even investors, who are supposed to be able to recognize real productivity when they see it.Even we were affected by the conventional wisdom.We thought of ourselves as impostors, succeeding despite being totally unprofessional.It was as if we'd created a Formula 1 car but felt sheepish because it didn't look like a car was supposed to look.In the car world, there are at least some people who know that a high performance car looks like a Formula 1 racecar, not a sedan with giant rims and a fake spoiler bolted to the trunk.Why not in business?Probably because startups are so small."", ""What We Look for in Founders\n\nOctober 2010\n\nWant to start a startup?Get funded by Y Combinator.(I wrote this for Forbes, who asked me to write something about the qualities we look for in founders.In print they had to cut the last item because they didn't have room.)1.DeterminationThis has turned out to be the most important quality in startup founders.We thought when we started Y Combinator that the most important quality would be intelligence.That's the myth in the Valley.And certainly you don't want founders to be stupid."", ""Obviously one case where it would help to be rapacious is when growth depends on that.What makes startups different is that usually it doesn't.Startups usually win by making something so great that people recommend it to their friends.And being rapacious not only doesn't help you do that, but probably hurts.[3]The reason startup founders can safely be nice is that making great things is compounded, and rapacity isn't.So if you're a founder, here's a deal you can make with yourself that will both make you happy and make your company successful."", '[2] In fact since 2 ≈ 1.05 ^ 15, the un-rapacious founder is always 15 weeks behind the rapacious one.[3] The other reason it might help to be good at squeezing money out of customers is that startups usually lose money at first, and making more per customer makes it easier to get to profitability before your initial funding runs out.But while it is very common for startups to die from running through their initial funding and then being unable to raise more, the underlying cause is usually slow growth or excessive spending rather than insufficient effort to extract money from existing customers.', ""But as long as you're over a certain threshold of intelligence, what matters most is determination.You're going to hit a lot of obstacles.You can't be the sort of person who gets demoralized easily.Bill Clerico and Rich Aberman of WePay are a good example.They're doing a finance startup, which means endless negotiations with big, bureaucratic companies.When you're starting a startup that depends on deals with big companies to exist, it often feels like they're trying to ignore you out of existence."", 'But when Bill Clerico starts calling you, you may as well do what he asks, because he is not going away.2.FlexibilityYou do not however want the sort of determination implied by phrases like ""don\'t give up on your dreams.""The world of startups is so unpredictable that you need to be able to modify your dreams on the fly.The best metaphor I\'ve found for the combination of determination and flexibility you need is a running back.He\'s determined to get downfield, but at any given moment he may need to go sideways or even backwards to get there.', ""The switch to the new norm may be surprisingly fast, because the startups that can retain control tend to be the best ones.They're the ones that set the trends, both for other startups and for VCs.A lot of the reason VCs are harsh when negotiating with startups is that they're embarrassed to go back to their partners looking like they got beaten.When they sign a termsheet, they want to be able to brag about the good terms they got.A lot of them don't care that much personally about whether founders keep board control.They just don't want to seem like they had to make concessions."", ""Tell yourself you can be as nice as you want, so long as you work hard on your growth rate to compensate.Most successful startups make that tradeoff unconsciously.Maybe if you do it consciously you'll do it even better.Notes[1] Many think successful startup founders are driven by money.In fact the secret weapon of the most successful founders is that they aren't.If they were, they'd have taken one of the acquisition offers that every fast-growing startup gets on the way up.What drives the most successful founders is the same thing that drives most people who make things: the company is their project.""]",5.0,0.0625,1.0,0.125,0.8333333333333334,0.6041666666666667
Why is frienship a good quality of founders?,Friendship is a good quality of founders because building a startup is tough and without a strong friendship building the startup will tear the founders apart.,"Friendship is a good quality of founders because it helps to establish a strong relationship between them. When founders genuinely like one another and work well together, it creates a positive and harmonious working environment. This strong bond allows them to understand each other's thoughts and perspectives, leading to effective communication and collaboration. Additionally, friendship between founders helps to build trust and resolve conflicts in a healthy manner. Ultimately, a strong friendship between founders contributes to the overall success of a startup.","[""Most of the big successes have two or three.And the relationship between the founders has to be strong.They must genuinely like one another, and work well together.Startups do to the relationship between the founders what a dog does to a sock: if it can be pulled apart, it will be.Emmett Shear and Justin Kan of Justin.tv are a good example of close friends who work well together.They've known each other since second grade.They can practically read one another's minds.I'm sure they argue, like all founders, but I have never once sensed any unresolved tension between them."", ""This quality may be redundant though; it may be implied by imagination.Sam Altman of Loopt is one of the most successful alumni, so we asked him what question we could put on the Y Combinator application that would help us discover more people like him.He said to ask about a time when they'd hacked something to their advantage—hacked in the sense of beating the system, not breaking into computers.It has become one of the questions we pay most attention to when judging applications.5.FriendshipEmpirically it seems to be hard to start a startup with just one founder."", ""Why It's Safe for Founders to Be Nice\n\nAugust 2015\n\nI recently got an email from a founder that helped me understand something important: why it's safe for startup founders to be nice people.I grew up with a cartoon idea of a very successful businessman (in the cartoon it was always a man): a rapacious, cigar-smoking, table-thumping guy in his fifties who wins by exercising power, and isn't too fussy about how.As I've written before, one of the things that has surprised me most about startups is how few of the most successful founders are like that."", ""What We Look for in Founders\n\nOctober 2010\n\nWant to start a startup?Get funded by Y Combinator.(I wrote this for Forbes, who asked me to write something about the qualities we look for in founders.In print they had to cut the last item because they didn't have room.)1.DeterminationThis has turned out to be the most important quality in startup founders.We thought when we started Y Combinator that the most important quality would be intelligence.That's the myth in the Valley.And certainly you don't want founders to be stupid."", ""Obviously one case where it would help to be rapacious is when growth depends on that.What makes startups different is that usually it doesn't.Startups usually win by making something so great that people recommend it to their friends.And being rapacious not only doesn't help you do that, but probably hurts.[3]The reason startup founders can safely be nice is that making great things is compounded, and rapacity isn't.So if you're a founder, here's a deal you can make with yourself that will both make you happy and make your company successful."", ""If they know they can't fire the founders, they'll have to choose founders they can trust.And that's who they should have been choosing all along.Thanks to Sam Altman, John Bautista, Trevor Blackwell, Paul Buchheit, Brian Chesky, Bill Clerico, Patrick Collison, Adam Goldstein, James Lindenbaum, Jessica Livingston, and Fred Wilson for reading drafts of this."", 'Maybe successful people in other industries are; I don\'t know; but not startup founders.[1]I knew this empirically, but I never saw the math of why till I got this founder\'s email.In it he said he worried that he was fundamentally soft-hearted and tended to give away too much for free.He thought perhaps he needed ""a little dose of sociopath-ness.""I told him not to worry about it, because so long as he built something good enough to spread by word of mouth, he\'d have a superlinear growth curve.', ""Tell yourself you can be as nice as you want, so long as you work hard on your growth rate to compensate.Most successful startups make that tradeoff unconsciously.Maybe if you do it consciously you'll do it even better.Notes[1] Many think successful startup founders are driven by money.In fact the secret weapon of the most successful founders is that they aren't.If they were, they'd have taken one of the acquisition offers that every fast-growing startup gets on the way up.What drives the most successful founders is the same thing that drives most people who make things: the company is their project."", ""If I could tell startups only ten sentences, this would be one of them.Now he's cofounder of a startup called Friendfeed.It's only a year old, but already everyone in the Valley is watching them.Someone responsible for three of the biggest ideas at Google is going to come up with more.5.Sam AltmanI was told I shouldn't mention founders of YC-funded companies in this list.But Sam Altman can't be stopped by such flimsy rules.If he wants to be on this list, he's going to be."", ""As soon as we heard they'd been supporting themselves by selling Obama and McCain branded breakfast cereal, they were in.And it turned out the idea was on the right side of crazy after all.4.NaughtinessThough the most successful founders are usually good people, they tend to have a piratical gleam in their eye.They're not Goody Two-Shoes type good.Morally, they care about getting the big questions right, but not about observing proprieties.That's why I'd use the word naughty rather than evil.They delight in breaking rules, but not rules that matter."", ""I feel like we're at a tipping point here.A lot of VCs still act as if founders retaining board control after a series A is unheard-of.A lot of them try to make you feel bad if you even ask — as if you're a noob or a control freak for wanting such a thing.But the founders I heard from aren't noobs or control freaks.Or if they are, they are, like Mark Zuckerberg, the kind of noobs and control freaks VCs should be trying to fund more of.Founders retaining control after a series A is clearly heard-of."", '[2] In fact since 2 ≈ 1.05 ^ 15, the un-rapacious founder is always 15 weeks behind the rapacious one.[3] The other reason it might help to be good at squeezing money out of customers is that startups usually lose money at first, and making more per customer makes it easier to get to profitability before your initial funding runs out.But while it is very common for startups to die from running through their initial funding and then being unable to raise more, the underlying cause is usually slow growth or excessive spending rather than insufficient effort to extract money from existing customers.', ""Learning from Founders\n\nJanuary 2007\n\n(Foreword to Jessica Livingston's Founders at Work.)Apparently sprinters reach their highest speed right out of the blocks, and spend the rest of the race slowing down.The winners slow down the least.It's that way with most startups too.The earliest phase is usually the most productive.That's when they have the really big ideas.Imagine what Apple was like when 100% of its employees were either Steve Jobs or Steve Wozniak.The striking thing about this phase is that it's completely different from most people's idea of what business is like."", ""Which means if letting the founders keep control stops being perceived as a concession, it will rapidly become much more common.Like a lot of changes that have been forced on VCs, this change won't turn out to be as big a problem as they might think.VCs will still be able to convince; they just won't be able to compel.And the startups where they have to resort to compulsion are not the ones that matter anyway.VCs make most of their money from a few big hits, and those aren't them.Knowing that founders will keep control of the board may even help VCs pick better."", ""The switch to the new norm may be surprisingly fast, because the startups that can retain control tend to be the best ones.They're the ones that set the trends, both for other startups and for VCs.A lot of the reason VCs are harsh when negotiating with startups is that they're embarrassed to go back to their partners looking like they got beaten.When they sign a termsheet, they want to be able to brag about the good terms they got.A lot of them don't care that much personally about whether founders keep board control.They just don't want to seem like they had to make concessions."", ""Five Founders\n\nApril 2009\n\nInc recently asked me who I thought were the 5 most interesting startup founders of the last 30 years.How do you decide who's the most interesting?The best test seemed to be influence: who are the 5 who've influenced me most?Who do I use as examples when I'm talking to companies we fund?Who do I find myself quoting?1.Steve JobsI'd guess Steve is the most influential founder not just for me but for most people you could ask.A lot of startup culture is Apple culture.He was the original young founder.""]",5.0,0.125,0.5,0.0625,1.0,0.5375
Why is determination the most important quality in startup founders?,"Because when building a startup you're going to hit a lot of obstacles, and determination will prevent one from getting demoralized by the constant obstacles.","Determination is considered the most important quality in startup founders because starting a startup involves facing numerous obstacles and challenges. It is crucial for founders to have the resilience and perseverance to overcome these obstacles without getting easily demoralized. While intelligence is also important, as long as founders meet a certain threshold of intelligence, determination becomes the key factor in their success. Founders need to be able to work hard and maintain a high growth rate to compensate for the difficulties they encounter. Ultimately, determination allows founders to stay focused on their goals and drive the success of their startup.","[""What We Look for in Founders\n\nOctober 2010\n\nWant to start a startup?Get funded by Y Combinator.(I wrote this for Forbes, who asked me to write something about the qualities we look for in founders.In print they had to cut the last item because they didn't have room.)1.DeterminationThis has turned out to be the most important quality in startup founders.We thought when we started Y Combinator that the most important quality would be intelligence.That's the myth in the Valley.And certainly you don't want founders to be stupid."", ""But as long as you're over a certain threshold of intelligence, what matters most is determination.You're going to hit a lot of obstacles.You can't be the sort of person who gets demoralized easily.Bill Clerico and Rich Aberman of WePay are a good example.They're doing a finance startup, which means endless negotiations with big, bureaucratic companies.When you're starting a startup that depends on deals with big companies to exist, it often feels like they're trying to ignore you out of existence."", ""Tell yourself you can be as nice as you want, so long as you work hard on your growth rate to compensate.Most successful startups make that tradeoff unconsciously.Maybe if you do it consciously you'll do it even better.Notes[1] Many think successful startup founders are driven by money.In fact the secret weapon of the most successful founders is that they aren't.If they were, they'd have taken one of the acquisition offers that every fast-growing startup gets on the way up.What drives the most successful founders is the same thing that drives most people who make things: the company is their project."", 'But when Bill Clerico starts calling you, you may as well do what he asks, because he is not going away.2.FlexibilityYou do not however want the sort of determination implied by phrases like ""don\'t give up on your dreams.""The world of startups is so unpredictable that you need to be able to modify your dreams on the fly.The best metaphor I\'ve found for the combination of determination and flexibility you need is a running back.He\'s determined to get downfield, but at any given moment he may need to go sideways or even backwards to get there.', ""This quality may be redundant though; it may be implied by imagination.Sam Altman of Loopt is one of the most successful alumni, so we asked him what question we could put on the Y Combinator application that would help us discover more people like him.He said to ask about a time when they'd hacked something to their advantage—hacked in the sense of beating the system, not breaking into computers.It has become one of the questions we pay most attention to when judging applications.5.FriendshipEmpirically it seems to be hard to start a startup with just one founder."", ""Learning from Founders\n\nJanuary 2007\n\n(Foreword to Jessica Livingston's Founders at Work.)Apparently sprinters reach their highest speed right out of the blocks, and spend the rest of the race slowing down.The winners slow down the least.It's that way with most startups too.The earliest phase is usually the most productive.That's when they have the really big ideas.Imagine what Apple was like when 100% of its employees were either Steve Jobs or Steve Wozniak.The striking thing about this phase is that it's completely different from most people's idea of what business is like."", ""The really dramatic growth happens when a startup only has three or four people, so only three or four people see that, whereas tens of thousands see business as it's practiced by Boeing or Philip Morris.This book can help fix that problem, by showing everyone what, till now, only a handful people got to see: what happens in the first year of a startup.This is what real productivity looks like.This is the Formula 1 racecar.It looks weird, but it goes fast.Of course, big companies won't be able to do everything these startups do."", ""Five Founders\n\nApril 2009\n\nInc recently asked me who I thought were the 5 most interesting startup founders of the last 30 years.How do you decide who's the most interesting?The best test seemed to be influence: who are the 5 who've influenced me most?Who do I use as examples when I'm talking to companies we fund?Who do I find myself quoting?1.Steve JobsI'd guess Steve is the most influential founder not just for me but for most people you could ask.A lot of startup culture is Apple culture.He was the original young founder."", ""Most of the big successes have two or three.And the relationship between the founders has to be strong.They must genuinely like one another, and work well together.Startups do to the relationship between the founders what a dog does to a sock: if it can be pulled apart, it will be.Emmett Shear and Justin Kan of Justin.tv are a good example of close friends who work well together.They've known each other since second grade.They can practically read one another's minds.I'm sure they argue, like all founders, but I have never once sensed any unresolved tension between them."", ""The switch to the new norm may be surprisingly fast, because the startups that can retain control tend to be the best ones.They're the ones that set the trends, both for other startups and for VCs.A lot of the reason VCs are harsh when negotiating with startups is that they're embarrassed to go back to their partners looking like they got beaten.When they sign a termsheet, they want to be able to brag about the good terms they got.A lot of them don't care that much personally about whether founders keep board control.They just don't want to seem like they had to make concessions."", ""Obviously one case where it would help to be rapacious is when growth depends on that.What makes startups different is that usually it doesn't.Startups usually win by making something so great that people recommend it to their friends.And being rapacious not only doesn't help you do that, but probably hurts.[3]The reason startup founders can safely be nice is that making great things is compounded, and rapacity isn't.So if you're a founder, here's a deal you can make with yourself that will both make you happy and make your company successful."", 'Honestly, Sam is, along with Steve Jobs, the founder I refer to most when I\'m advising startups.On questions of design, I ask ""What would Steve do?""but on questions of strategy or ambition I ask ""What would Sama do?""What I learned from meeting Sama is that the doctrine of the elect applies to startups.It applies way less than most people think: startup investing does not consist of trying to pick winners the way you might in a horse race.But there are a few people with such force of will that they\'re going to get whatever they want.', ""The current record holder for flexibility may be Daniel Gross of Greplin.He applied to YC with some bad ecommerce idea.We told him we'd fund him if he did something else.He thought for a second, and said ok.He then went through two more ideas before settling on Greplin.He'd only been working on it for a couple days when he presented to investors at Demo Day, but he got a lot of interest.He always seems to land on his feet.3.ImaginationIntelligence does matter a lot of course.It seems like the type that matters most is imagination."", 'If you looked in people\'s heads (or stock photo collections) for images representing ""business,"" you\'d get images of people dressed up in suits, groups sitting around conference tables looking serious, Powerpoint presentations, people producing thick reports for one another to read.Early stage startups are the exact opposite of this.And yet they\'re probably the most productive part of the whole economy.Why the disconnect?I think there\'s a general principle at work here: the less energy people expend on performance, the more they expend on appearances to compensate.More often than not the energy they expend on seeming impressive makes their actual performance worse.', ""Why It's Safe for Founders to Be Nice\n\nAugust 2015\n\nI recently got an email from a founder that helped me understand something important: why it's safe for startup founders to be nice people.I grew up with a cartoon idea of a very successful businessman (in the cartoon it was always a man): a rapacious, cigar-smoking, table-thumping guy in his fifties who wins by exercising power, and isn't too fussy about how.As I've written before, one of the things that has surprised me most about startups is how few of the most successful founders are like that."", ""Which means if letting the founders keep control stops being perceived as a concession, it will rapidly become much more common.Like a lot of changes that have been forced on VCs, this change won't turn out to be as big a problem as they might think.VCs will still be able to convince; they just won't be able to compel.And the startups where they have to resort to compulsion are not the ones that matter anyway.VCs make most of their money from a few big hits, and those aren't them.Knowing that founders will keep control of the board may even help VCs pick better.""]",5.0,0.25,0.5,0.125,1.0,0.575
"For startups, what does board control mean in practice?","During board meetings, matters are decided in the discussion preceding the vote, not in the vote itself, which is usually unanimous. If opinion is divided in such discussions, the side that knows it would lose in a vote tends to be less insistent. This is what board control means in practice.","Board control for startups means having the majority of board seats and being able to influence decisions and actions taken by the board. It allows founders to have a greater say in what is in the best interest of the company and its shareholders. While board control does not equate to total control, it does give founders a significant advantage in shaping the direction and decision-making of the startup.","[""You don't simply get to do whatever you want; the board still has to act in the interest of the shareholders; but if you have a majority of board seats, then your opinion about what's in the interest of the shareholders will tend to prevail.So while board control is not total control, it's not imaginary either.There's inevitably a difference in how things feel within the company.Which means if it becomes the norm for founders to retain board control after a series A, that will change the way things feel in the whole startup world."", ""Founder Control\n\nDecember 2010\n\nWant to start a startup?Get funded by Y Combinator.Someone we funded is talking to VCs now, and asked me how common it was for a startup's founders to retain control of the board after a series A round.He said VCs told him this almost never happened.Ten years ago that was true.In the past, founders rarely kept control of the board through a series A.The traditional series A board consisted of two founders, two VCs, and one independent member.More recently the recipe is often one founder, one VC, and one independent."", ""And barring financial catastrophe, I think in the coming year it will become the norm.Control of a company is a more complicated matter than simply outvoting other parties in board meetings.Investors usually get vetos over certain big decisions, like selling the company, regardless of how many board seats they have.And board votes are rarely split.Matters are decided in the discussion preceding the vote, not in the vote itself, which is usually unanimous.But if opinion is divided in such discussions, the side that knows it would lose in a vote will tend to be less insistent.That's what board control means in practice."", ""Which means if letting the founders keep control stops being perceived as a concession, it will rapidly become much more common.Like a lot of changes that have been forced on VCs, this change won't turn out to be as big a problem as they might think.VCs will still be able to convince; they just won't be able to compel.And the startups where they have to resort to compulsion are not the ones that matter anyway.VCs make most of their money from a few big hits, and those aren't them.Knowing that founders will keep control of the board may even help VCs pick better."", ""The switch to the new norm may be surprisingly fast, because the startups that can retain control tend to be the best ones.They're the ones that set the trends, both for other startups and for VCs.A lot of the reason VCs are harsh when negotiating with startups is that they're embarrassed to go back to their partners looking like they got beaten.When they sign a termsheet, they want to be able to brag about the good terms they got.A lot of them don't care that much personally about whether founders keep board control.They just don't want to seem like they had to make concessions."", ""I feel like we're at a tipping point here.A lot of VCs still act as if founders retaining board control after a series A is unheard-of.A lot of them try to make you feel bad if you even ask — as if you're a noob or a control freak for wanting such a thing.But the founders I heard from aren't noobs or control freaks.Or if they are, they are, like Mark Zuckerberg, the kind of noobs and control freaks VCs should be trying to fund more of.Founders retaining control after a series A is clearly heard-of."", ""In either case the founders lose their majority.But not always.Mark Zuckerberg kept control of Facebook's board through the series A and still has it today.Mark Pincus has kept control of Zynga's too.But are these just outliers?How common is it for founders to keep control after an A round?I'd heard of several cases among the companies we've funded, but I wasn't sure how many there were, so I emailed the ycfounders list.The replies surprised me.In a dozen companies we've funded, the founders still had a majority of the board seats after the series A round."", ""The really dramatic growth happens when a startup only has three or four people, so only three or four people see that, whereas tens of thousands see business as it's practiced by Boeing or Philip Morris.This book can help fix that problem, by showing everyone what, till now, only a handful people got to see: what happens in the first year of a startup.This is what real productivity looks like.This is the Formula 1 racecar.It looks weird, but it goes fast.Of course, big companies won't be able to do everything these startups do."", ""In big companies there's always going to be more politics, and less scope for individual decisions.But seeing what startups are really like will at least show other organizations what to aim for.The time may soon be coming when instead of startups trying to seem more corporate, corporations will try to seem more like startups.That would be a good thing.Japanese Translation."", ""This quality may be redundant though; it may be implied by imagination.Sam Altman of Loopt is one of the most successful alumni, so we asked him what question we could put on the Y Combinator application that would help us discover more people like him.He said to ask about a time when they'd hacked something to their advantage—hacked in the sense of beating the system, not breaking into computers.It has become one of the questions we pay most attention to when judging applications.5.FriendshipEmpirically it seems to be hard to start a startup with just one founder."", 'If you looked in people\'s heads (or stock photo collections) for images representing ""business,"" you\'d get images of people dressed up in suits, groups sitting around conference tables looking serious, Powerpoint presentations, people producing thick reports for one another to read.Early stage startups are the exact opposite of this.And yet they\'re probably the most productive part of the whole economy.Why the disconnect?I think there\'s a general principle at work here: the less energy people expend on performance, the more they expend on appearances to compensate.More often than not the energy they expend on seeming impressive makes their actual performance worse.', 'Honestly, Sam is, along with Steve Jobs, the founder I refer to most when I\'m advising startups.On questions of design, I ask ""What would Steve do?""but on questions of strategy or ambition I ask ""What would Sama do?""What I learned from meeting Sama is that the doctrine of the elect applies to startups.It applies way less than most people think: startup investing does not consist of trying to pick winners the way you might in a horse race.But there are a few people with such force of will that they\'re going to get whatever they want.', 'But when Bill Clerico starts calling you, you may as well do what he asks, because he is not going away.2.FlexibilityYou do not however want the sort of determination implied by phrases like ""don\'t give up on your dreams.""The world of startups is so unpredictable that you need to be able to modify your dreams on the fly.The best metaphor I\'ve found for the combination of determination and flexibility you need is a running back.He\'s determined to get downfield, but at any given moment he may need to go sideways or even backwards to get there.', ""Tell yourself you can be as nice as you want, so long as you work hard on your growth rate to compensate.Most successful startups make that tradeoff unconsciously.Maybe if you do it consciously you'll do it even better.Notes[1] Many think successful startup founders are driven by money.In fact the secret weapon of the most successful founders is that they aren't.If they were, they'd have taken one of the acquisition offers that every fast-growing startup gets on the way up.What drives the most successful founders is the same thing that drives most people who make things: the company is their project."", ""Learning from Founders\n\nJanuary 2007\n\n(Foreword to Jessica Livingston's Founders at Work.)Apparently sprinters reach their highest speed right out of the blocks, and spend the rest of the race slowing down.The winners slow down the least.It's that way with most startups too.The earliest phase is usually the most productive.That's when they have the really big ideas.Imagine what Apple was like when 100% of its employees were either Steve Jobs or Steve Wozniak.The striking thing about this phase is that it's completely different from most people's idea of what business is like."", ""But as long as you're over a certain threshold of intelligence, what matters most is determination.You're going to hit a lot of obstacles.You can't be the sort of person who gets demoralized easily.Bill Clerico and Rich Aberman of WePay are a good example.They're doing a finance startup, which means endless negotiations with big, bureaucratic companies.When you're starting a startup that depends on deals with big companies to exist, it often feels like they're trying to ignore you out of existence.""]",4.0,0.375,0.5,0.1875,1.0,0.5725
What's in the way of founders keeping board control after a series A?,"The perception that founders keeping board control after a series A being a concession a VC has made when negotiating with startups. VCs do not want to look like they've lost a negotiation. If founders keeping control after a series A is the norm, then it happening will not look like the VCs lost the negotiation.","VCs often act as if founders retaining board control after a series A is unheard-of. They try to make founders feel bad for even asking for such control. However, the founders who want to retain control are not necessarily noobs or control freaks. In fact, founders like Mark Zuckerberg and Mark Pincus have successfully kept control of their companies' boards after a series A. While founders may lose their majority on the board, it is not impossible for them to retain control. The perception that founders keeping control is a concession needs to change in order for it to become more common.","[""Founder Control\n\nDecember 2010\n\nWant to start a startup?Get funded by Y Combinator.Someone we funded is talking to VCs now, and asked me how common it was for a startup's founders to retain control of the board after a series A round.He said VCs told him this almost never happened.Ten years ago that was true.In the past, founders rarely kept control of the board through a series A.The traditional series A board consisted of two founders, two VCs, and one independent member.More recently the recipe is often one founder, one VC, and one independent."", ""I feel like we're at a tipping point here.A lot of VCs still act as if founders retaining board control after a series A is unheard-of.A lot of them try to make you feel bad if you even ask — as if you're a noob or a control freak for wanting such a thing.But the founders I heard from aren't noobs or control freaks.Or if they are, they are, like Mark Zuckerberg, the kind of noobs and control freaks VCs should be trying to fund more of.Founders retaining control after a series A is clearly heard-of."", ""In either case the founders lose their majority.But not always.Mark Zuckerberg kept control of Facebook's board through the series A and still has it today.Mark Pincus has kept control of Zynga's too.But are these just outliers?How common is it for founders to keep control after an A round?I'd heard of several cases among the companies we've funded, but I wasn't sure how many there were, so I emailed the ycfounders list.The replies surprised me.In a dozen companies we've funded, the founders still had a majority of the board seats after the series A round."", ""Which means if letting the founders keep control stops being perceived as a concession, it will rapidly become much more common.Like a lot of changes that have been forced on VCs, this change won't turn out to be as big a problem as they might think.VCs will still be able to convince; they just won't be able to compel.And the startups where they have to resort to compulsion are not the ones that matter anyway.VCs make most of their money from a few big hits, and those aren't them.Knowing that founders will keep control of the board may even help VCs pick better."", ""You don't simply get to do whatever you want; the board still has to act in the interest of the shareholders; but if you have a majority of board seats, then your opinion about what's in the interest of the shareholders will tend to prevail.So while board control is not total control, it's not imaginary either.There's inevitably a difference in how things feel within the company.Which means if it becomes the norm for founders to retain board control after a series A, that will change the way things feel in the whole startup world."", ""The switch to the new norm may be surprisingly fast, because the startups that can retain control tend to be the best ones.They're the ones that set the trends, both for other startups and for VCs.A lot of the reason VCs are harsh when negotiating with startups is that they're embarrassed to go back to their partners looking like they got beaten.When they sign a termsheet, they want to be able to brag about the good terms they got.A lot of them don't care that much personally about whether founders keep board control.They just don't want to seem like they had to make concessions."", ""If they know they can't fire the founders, they'll have to choose founders they can trust.And that's who they should have been choosing all along.Thanks to Sam Altman, John Bautista, Trevor Blackwell, Paul Buchheit, Brian Chesky, Bill Clerico, Patrick Collison, Adam Goldstein, James Lindenbaum, Jessica Livingston, and Fred Wilson for reading drafts of this."", ""And barring financial catastrophe, I think in the coming year it will become the norm.Control of a company is a more complicated matter than simply outvoting other parties in board meetings.Investors usually get vetos over certain big decisions, like selling the company, regardless of how many board seats they have.And board votes are rarely split.Matters are decided in the discussion preceding the vote, not in the vote itself, which is usually unanimous.But if opinion is divided in such discussions, the side that knows it would lose in a vote will tend to be less insistent.That's what board control means in practice."", ""This quality may be redundant though; it may be implied by imagination.Sam Altman of Loopt is one of the most successful alumni, so we asked him what question we could put on the Y Combinator application that would help us discover more people like him.He said to ask about a time when they'd hacked something to their advantage—hacked in the sense of beating the system, not breaking into computers.It has become one of the questions we pay most attention to when judging applications.5.FriendshipEmpirically it seems to be hard to start a startup with just one founder."", ""What We Look for in Founders\n\nOctober 2010\n\nWant to start a startup?Get funded by Y Combinator.(I wrote this for Forbes, who asked me to write something about the qualities we look for in founders.In print they had to cut the last item because they didn't have room.)1.DeterminationThis has turned out to be the most important quality in startup founders.We thought when we started Y Combinator that the most important quality would be intelligence.That's the myth in the Valley.And certainly you don't want founders to be stupid."", ""Most of the big successes have two or three.And the relationship between the founders has to be strong.They must genuinely like one another, and work well together.Startups do to the relationship between the founders what a dog does to a sock: if it can be pulled apart, it will be.Emmett Shear and Justin Kan of Justin.tv are a good example of close friends who work well together.They've known each other since second grade.They can practically read one another's minds.I'm sure they argue, like all founders, but I have never once sensed any unresolved tension between them."", ""Learning from Founders\n\nJanuary 2007\n\n(Foreword to Jessica Livingston's Founders at Work.)Apparently sprinters reach their highest speed right out of the blocks, and spend the rest of the race slowing down.The winners slow down the least.It's that way with most startups too.The earliest phase is usually the most productive.That's when they have the really big ideas.Imagine what Apple was like when 100% of its employees were either Steve Jobs or Steve Wozniak.The striking thing about this phase is that it's completely different from most people's idea of what business is like."", ""If I could tell startups only ten sentences, this would be one of them.Now he's cofounder of a startup called Friendfeed.It's only a year old, but already everyone in the Valley is watching them.Someone responsible for three of the biggest ideas at Google is going to come up with more.5.Sam AltmanI was told I shouldn't mention founders of YC-funded companies in this list.But Sam Altman can't be stopped by such flimsy rules.If he wants to be on this list, he's going to be."", ""Why It's Safe for Founders to Be Nice\n\nAugust 2015\n\nI recently got an email from a founder that helped me understand something important: why it's safe for startup founders to be nice people.I grew up with a cartoon idea of a very successful businessman (in the cartoon it was always a man): a rapacious, cigar-smoking, table-thumping guy in his fifties who wins by exercising power, and isn't too fussy about how.As I've written before, one of the things that has surprised me most about startups is how few of the most successful founders are like that."", '[2] In fact since 2 ≈ 1.05 ^ 15, the un-rapacious founder is always 15 weeks behind the rapacious one.[3] The other reason it might help to be good at squeezing money out of customers is that startups usually lose money at first, and making more per customer makes it easier to get to profitability before your initial funding runs out.But while it is very common for startups to die from running through their initial funding and then being unable to raise more, the underlying cause is usually slow growth or excessive spending rather than insufficient effort to extract money from existing customers.', ""The Founder Visa\n\nApril 2009\n\nI usually avoid politics, but since we now seem to have an administration that's open to suggestions, I'm going to risk making one.The single biggest thing the government could do to increase the number of startups in this country is a policy that would cost nothing: establish a new class of visa for startup founders.The biggest constraint on the number of new startups that get created in the US is not tax policy or employment law or even Sarbanes-Oxley.It's that we won't let the people who want to start them into the country.""]",4.0,0.4375,0.8571428571428571,0.375,1.0,0.6939285714285715
